店舗名,住所・電話番号,電話番号,営業時間,駐車場
新たつの店,兵庫県たつの市龍野町小宅北字前田41番11,(0791)62-9107,AM10:00?PM8:00,51台
新福崎店,兵庫県神崎郡福崎町南田原2255番地1,(0791)62-9107,AM10:00?PM8:00,49台
滝野社店,兵庫県加東市北野字片山657-3,(079)548-3810,AM10:00?PM8:00,21台
フレスポ赤穂店,兵庫県赤穂市中広2-8,(0791)42-3280,AM10:00?PM8:00,79台
アクロスプラザ西脇店,兵庫県西脇市高田井町55番1,(0795)24-7731,AM10:00?PM8:00,94台
ｉモール高砂店,兵庫県高砂市米田町島32番地A-2,(079)433-2065,AM10:00?PM8:00,183台
加古川別府店,兵庫県加古川市別府町石町95-1,(0791)62-9107,AM10:00?PM8:00,32台
加古川北在家店,兵庫県加古川市加古川町北在家字藪田755-1,(079)422-7776,AM10:00?PM8:00,31台
二見店,兵庫県明石市二見町西二見31-9,(078)943-4305,AM10:00?PM8:00,13台
明石魚住店,兵庫県明石市魚住町中尾508番地,(078)946-0533,AM10:00?PM8:00,172台
三木青山店,兵庫県三木市志染町青山5丁目30番6,(0794)85-8181,AM10:00?PM8:00,66台
三木大村店,兵庫県三木市大村505-1,(079)483-6643,AM10:00?PM8:00,42台
明石鳥羽店,兵庫県明石市鳥羽1561番地,(078)923-8116,AM10:00?PM8:00,16台
飾磨店,兵庫県姫路市飾磨区恵美酒松之本232,(079)234-4925,AM10:00?PM8:00,105台
新山崎店,兵庫県宍粟市山崎町鶴木8-2,(0790)63-0787,AM10:00?PM8:00,30台
網干和久店,兵庫県姫路市網干区和久字下丁田12-1,(079)274-5991,AM10:00?PM8:00,54台
広畑西店,兵庫県姫路市広畑区小松町2丁目76番,(079)237-9558,AM10:00?PM8:00,26台
花田店,兵庫県姫路市花田町上原田192-1,(079)253-1650,AM10:00?PM8:00,280台
新みゆき通り店,兵庫県姫路市紺屋町57,(079)282-1881,AM10:00?PM7:00,なし
北姫路店,兵庫県姫路市増位新町2-26,(079)282-2673,AM10:00?PM7:00,6台
辻井店 ,兵庫県姫路市東辻井1丁目237-1,(079)295-9544,AM10:00?PM8:00,31台
和田山店 ,兵庫県朝来市和田山町法道寺字新中野809-1,(079)672-0916,AM10:00?PM7:00,33台
柏原店 ,兵庫県丹波市柏原町南多田字高土井476-1,(079)572-4704,AM10:00?PM8:00,19台
篠山店 ,兵庫県篠山市東岡屋字桑ノ木ノ坪175-4,(079)552-8255,AM10:00?PM8:00,36台
三田店 ,兵庫県三田市弥生が丘1丁目8番,(079)563-9940,AM10:00?PM8:00,30台
豊岡店,兵庫県豊岡市九日市中町字権現132番17,(0796)22-1430,AM10:00?PM8:00,204台
宝塚山本店,兵庫県宝塚市山本丸橋3丁目10番1号,(0797)89-8338,AM10:00?PM8:00,38台
伊丹行基店,兵庫県伊丹市行基町1丁目103番,(072)785-8556,AM10:00?PM8:00,20台
伊丹荒牧店,兵庫県伊丹市鴻池町7丁目3番10号,(072)770-2006,AM10:00?PM8:00,290台
コーナン西宮今津２号館店,兵庫県西宮市今津出在家町10番68号,(0798)38-8625,AM10:00?PM8:00,1428台
西宮門戸店,兵庫県西宮市大島町4-22,(0798)66-0661,AM10:00?PM8:00,35台
園田店,兵庫県尼崎市神崎町24-30,(06)6494-6522,AM10:00?PM8:00,18台
つかしん店,兵庫県尼崎市塚口本町4-8-1 ひがしまち南館3F,(06)6423-5322,AM10:00?PM9:00,2000台
尼崎西長洲店,兵庫県尼崎市西長洲町2丁目1-36,(06)6489-0611,AM10:00?PM8:00,23台
立花店,兵庫県尼崎市稲葉元町1丁目1-15,(06)6413-1848,AM10:00?PM8:00,21台
セルバ甲南山手店,兵庫県神戸市東灘区森南町1-5-1,(078)413-2577,AM10:00?PM8:00,330台
灘新在家店,兵庫県神戸市灘区新在家南町1丁目2-2,(078)858-4355,AM10:00?PM8:00,600台
南あわじ店,兵庫県南あわじ市広田広田字大御門586,(0799)45-0027,AM10:00?PM8:00,47台
垂水小束山店,兵庫県神戸市垂水区小束山本町3丁目2番2号,(078)782-9910,AM10:00?PM8:0011/18(土)はAM10:00?PM7:30です。,24台
北須磨店,兵庫県神戸市須磨区多井畑字渋人谷上4-1,(078)743-0560,AM10:00?PM8:00,202台
